Proposta,Eixo
promover central monitoramento remoto maior rapidez eficacia açoes atraves alta,Segurança
tecnologia camaras drones radios comunicadores mapas estrate gicos posicionamento patrulhas,Segurança
todo territorio,Segurança
ampliar sistema municipal vídeo monitoramento integrando sistemas ja existentes pu blicos,Segurança
privados ampliando areas definidas comum acordo conselhos segurança municipal,Segurança
priorizando pontos maior insegurança bairros,Segurança
instituir projeto luzilandia segura,Segurança
treinamento aperfeiçoamento padronizaçao aço es guarda civil luzilandia fim auxiliar,Segurança
polícia militar piauí combate criminalidade cidade luzila ndia,Segurança
implantaça projeto guarda armada apos minuciosa preparaçao seleça meio teste,Segurança
psicologico açao conjunta policia militar piauí polícia federal demais forças segurança,Segurança
criação centro monitoramento implantação câmeras principais ruas avenidas cidade,Segurança
ampliar serviços segurança rondas zona urbana rural município,Segurança
criar plano municipal segurança pública,Segurança
realizar monitoramento manutenção infraestruturas públicas,Segurança
implementar programa monitoramento contínuo infraestruturas públicas utilizando tecnologias vigilância inspeções regulares prevenir vandalismos danos,Segurança
criar plano segurança patrimônio histórico cultural,Segurança
desenvolver plano segurança específico proteger patrimônio histórico cultural município incluindo treinamento guarda municipal técnicas preservação resposta rápida incidentes,Segurança
promover integração trânsito secretaria segurança pública,Segurança
transformar secretaria municipal segurança pública “ secretaria municipal segurança pública mobilidade ” integrando funções trânsito visando melhorar mobilidade urbana reduzir acidentes,Segurança
potencializar campanhas educativas trânsito visando melhorar mobilidade urbana reduzir acidentes,Segurança
investir compra epis modernos toda corporação guarda municipal garantindo segurança durante operações,Segurança
ampliar sistema vídeo monitoramento,Segurança
implementar programa policiamento comunitário,Segurança
estabelecer centro integrado comando controle cicc coordenar ações segurança,Segurança
desenvolver projetos sociais áreas alta vulnerabilidade oferecendo atividades culturais esportivas educativas jovens visando afastá-los criminalidade,Segurança
apoiar ações fiscalização combate crimes ambientais promovendo proteção áreas verdes preservação município,Segurança
implementar operações especificas contra tráfico drogas patrulhamento intensivo áreas risco parceria forças estaduais federais desarticular redes criminosas,Segurança
desenvolver programa abrangente prevenção criminalidade incluindo ações educativas jovens,Segurança
promover cursos capacitação aperfeiçoamento sobre técnicas atendimento diferentes locais crime tendo destaque locais públicos repartições públicas,Segurança
dar subsídio polícia militar acordo demanda,Segurança
revitalizar convênio pronasci programa nacional segurança pública ministério justiça segurança pública visando implantar projetos articulem políticas segurança ações sociais preventivas direcionadas prioritariamente causas violência,Segurança
criar projetos parcerias polícia militar polícia civil ministério público conselho tutelar assistência social saúde educação etc. visando cumprimento estatuto criança adolescente proibição venda bebidas alcoólicas armas outros produtos menores 18 anos,Segurança
criar programa vizinhança solidária objetivo prevenir atos desrespeito convivência procurando agir coletivamente comunidades,Segurança
criação rede apoio dependentes químicos parceria estados entidades terceiro setor instrumento auxílio famílias hoje têm informações sobre onde obter ajuda rede viabilizará execução programa oferta local tratamento dependentes drogas serviços referência usuários,Segurança
instituição política incentivo apoio oferta atenção psicossocial usuários álcool drogas permitindo ações promoção prevenção assistência inserção social dependentes químicos familiares,Segurança
desenvolvimento programa municipal prevenção uso abusivo álcool outras drogas parceria estados união entidades terceiro setor priorizando jovens ações áreas cultura lazer esportes,Segurança
identificação pontos vulneráveis uso drogas município garantindo apoio transformar pontos áreas livres drogas,Segurança
apoio projetos educação formação profissional tempo integral áreas maior vulnerabilidade relação segurança,Segurança
apoio total polícia militar através parceria estado município,Segurança
implantação parceria estados programas prevenção acidentes trânsito,Segurança
garantir permanência segurança pública todos cidadãos cidadãs s igualmente todos adentrarem município julião respectivas adjacências,Segurança
zelar permanência ordem social todos segmentos públicos privados,Segurança
manter comunicação constante profissionais atuam segurança pública garantindo através destes permanência ronda policial todo trabalho segurança manter paz social,Segurança
firmar parceria órgãos governo estadual seleção agentes formação brigada ambiental,Segurança
definir responsabilidade estado segurança manutenção ordem pública espaços prédios eventos demandam participação coletiva condições segurança,Segurança
traçar parcerias brigada ambiental força policial estadual rondas ostensivas locais considerados críticos e/ou vulneráveis,Segurança
garantir iluminação pública qualidade toda cidade melhor atuação polícia militar conforto segurança moradores,Segurança
manutenção ampliação câmeras torres observação principais vias acesso enviarão imagens toda cidade tempo real central guarda municipal,Segurança
parceria governo estado controle segurança trânsito meio efetivo uso equipamentos segurança,Segurança
aprimorar interlocução junto órgãos segurança pública intuito promover valoreização policial demais agentes segurança pública,Segurança
criar calendário municipal dia homenagem agente segurança pública destacado ano município,Segurança
incentivar aproximação comunidades políticas públicas combate violência crime organizado,Segurança
implementar guarda municipal serem agentes efetivação direitos cidadania protegerem patrimônio público,Segurança
incentivar fortalecimento laços comunitários vizinhança aumentar redes informais proteção social,Segurança
fortalecer guarda municipal defesa civil instrumentos principais segurança cidadã parceria permanente segurança pública estado piauí,Segurança
fortalecer políticas públicas prevenção combate uso drogas álcool furtos roubos focadas indivíduo família escola comunidade,Segurança
instituir programa compartilhado governo sociedade manutenção espaço ordem pública,Segurança
instalação câmeras torres observação principais vias acesso prédios públicos enviarão imagens toda cidade tempo real central guarda municipal,Segurança
criar através projeto lei estrutura administrativa município departamento segurança municipal,Segurança
buscar parceria junto empresários comerciantes locais garantir melhoria segurança estabelecimentos comerciais,Segurança
construir predio gpm casa apio policiais trabalho municipio,Segurança
assegurar lotação permanência efetivo policial município através projeto lei autorizando convênio ssppi,Segurança
garantir iluminação pública qualidade toda cidade melhor atuação polícia militar maior conforto segurança moradores,Segurança
instalação câmeras torres observação principais vias acesso enviarão imagens toda cidade tempo real policia militar,Segurança
implementar convênio estado aumento efetivo polícia militar reestudo convênio segurança trânsito agricultura,Segurança
implantar programa municipal melhoramento genético objetivo auxiliar produtores leite gado corte aumentar produtividade renda,Segurança
implantar programa propriedade sustentável foco sustentabilidade financeira propriedade acompanhamento técnico gestão ferramentas presenciais on-line disponibilizadas site município,Segurança
implantar programas educação capacitação fortalecimento agricultores transformando-os empreendedores agronegócio efetivos resultados financeiros,Segurança
estabelecer parceria sindicato rural juntos planejarmos “ festa agricultot ” estrutura promovendo evento qualidade excelência,Segurança
incentivar pesquisas viabilidade inserção novas lavouras aproveitamento período ociosidade solo,Segurança
melhorar assistência técnica rural disponibilização servidores municipais área assessorar pequenos produtores locais,Segurança
cumprimento legislação trata obrigatoriedade parte municípios aquisição gêneros merenda escolar produtores locais,Segurança
preservar centro abastecimento mercado municipal garantindo higiene qualidade produtos oferecidos consumidores bem condições armazenamento comercialização agricultores familiares,Segurança
projeto cidade guardiã aprimorar ampliar monitoramento câmeras alta resolução visualização noturna monitores instalados centro inteligência local polícia civil militar,Segurança
criação guarda municipal cidadã,Segurança
pelotão mirim apoio incentivo projeto social visando práticas noções educativas disciplina segurança combate violência criminalidade,Segurança
promover programas fortalecer segurança município parcerias órgãos segurança,Segurança
elaborar plano municipal segurança pública,Segurança
implantar sistema vide monitoramento entradas saídas cidade bem ruas avenidas município parcerias órgãos segurança,Segurança
ampliar meio parceria órgãos segurança efetivo policiais município,Segurança
implantar pelotão mirim parceria polícia militar,Segurança
implantar programa palestras escolas temas abordados órgãos segurança enfrentamento uso drogas ● programa segurança participativa abrir diálogo sociedade busca promover políticas públicas segurança,Segurança
reforço guarda municipal treinamentos específicos equipamentos modernosvisando prevenção combate criminalidade,Segurança
criação centro monitoramento integrado câmeras segurança pontos estratégicos cidade aumentando sensação segurança cidadãos,Segurança
ampliar parceria secretaria segurança pública estado piauí,Segurança
firmar parceria governo estado combate criminalidade tráfico drogas município,Segurança
atuar parceria conselho tutelar resguardando competências legais órgão,Segurança
aumentar efetivo policial,Segurança
criação guarda municipal,Segurança
criação programas bombeiros mirim,Segurança
implantação vídeo monitoramento,Segurança
criar todos carros motos placa curralinhos identificação paralela detran,Segurança
garantir iluminação pública qualidade toda cidade melhor atuação polícia militar maior conforto segurança moradores,Segurança
organização regularização transito municipal prevendo inclusive criação cargos contratação guarda municipal deverá enviado proposta lei legislativo,Segurança
criação posto policial bairro novo horizonte,Segurança
instalçao câmeras segurança pontos estratégios centro comercial vias acesso cidade locais maior circulação parcerias policias civil militar,Segurança
segurança pública tema relevante total interesse parte desse governo visto garantia ir vir segurança direito fundamental previsto constituição federal 1988,Segurança
propostas avançar desempenho segurança eficiência município barra d'alcântara ciclo 2025 2028,Segurança
iniciar processo implantação guarda municipal trabalhar conjunto batalhão polícia militar,Segurança
viabilizar parceria governo estadual instalação câmeras observação principais vias acesso enviarão imagens tempo real polícia militar,Segurança
realizar municipalização trânsito,Segurança
garantir iluminação pública qualidade toda cidade melhor atuação polícia militar maior conforto segurança moradores,Segurança
instalar câmeras segurança enviarão imagens toda cidade tempo real policia militar,Segurança
implementar convênio estado aumento efetivo policia militar através convênio estado,Segurança
aquisição motos vigilância polícia militar,Segurança
segurança escolas,Segurança
vigilância 24 horas bairros,Segurança
implantar programa policiamento atuar violência contra mulheres,Segurança
dar subsídio polícia militar acordo demanda,Segurança
criar projetos parcerias polícia militar polícia civil ministério público conselho tutelar assistência social saúde educação etc visando cumprimento estatuto criança adolescente proibição venda bebidas alcoólicas armas outros produtos menores 18 anos,Segurança
implantação sistema monitoramento eletrônico municipio alegrete,Segurança
cumprir estatuto criança adolescente coibindo venda bebidas alcoólicas outros produtos menores 18 anos,Segurança
fortalecer ações segurança realizadas parceria demais instituições segurança existentes município,Segurança
segurança pública áreas urbanas rural,Segurança
implantação câmeras segurança pontos estratégicos cidade,Segurança
implantação sistema monitoramento eletrônico município,Segurança
projeto cidade guardiã aprimorar ampliar monitoramento câmeras alta resolução visualização noturna monitores instalados centro inteligência local polícia civil militar,Segurança
criação guarda municipal cidadã,Segurança
pelotão mirim apoio incentivo projeto social visando práticas noções educativas disciplina segurança combate violência criminalidade,Segurança
promover programas fortalecer segurança município parcerias órgãos segurança,Segurança
criação guarda municipal,Segurança
implantação vigilância comunitária localidades populosas,Segurança
apoio intensificação juntos polícias civil militar combate furtos roubo,Segurança
algumas ideias área segurança,Segurança
assegurar escolas municipais palestras sobre entorpecentes,Segurança
fazer cumprir lei proíbe venda bebidas alcoólicas menores 18 anos,Segurança
proibir entrada menores 18 anos casas shows,Segurança
criar políticas públicas área esporte crianças adolescentes,Segurança
parceira governo buscar recursos construção novo prédio delegacia bem cobrar aparelhamento delegacia polícia civil prata piauí,Segurança
fazer parceria conselho tutelar acompanhamento familiar alguns jovens situação risco,Segurança
criar canal ligação população denunciar qualquer tipo violência sendo doméstica outra natureza podendo através numero mantenha sigilo denunciante,Segurança
policiamento ostensivo canal ligação direta 24horas,Segurança
incentivar recolocação pelotão mirim visando atenção básica criança adolescente,Segurança
políticas prevenção crime público alvo principalmente crianças adolescentes algumas destas ações podem,Segurança
programas educação escolas trabalhem elaboração medidas visem redução ações violentas,Segurança
criação programas profissionalização lazer objetivo ocupar jovens período extraclasse evitando dessa forma envolvimento atividades ilícitas,Segurança
programas direcionados menores infratores diminuir chance cometerem novo crime,Segurança
ampliação modernização guarda municipal,Segurança
defender criação consórcio intermunicipal segurança pública,Segurança
implantar conselho municipal segurança pública,Segurança
instituir fundo municipal segurança pública,Segurança
promover transversalidade política municipal segurança pública junto demais secretarias.• providenciar adesão município programa nacional segurança pública cidadania pronasci apto captar recursos governo federal,Segurança
providenciar credenciamento município junto sistema infoseg sistema reúne informações justiças federal estadual detrans etc,Segurança
implantar unidade defesa civil elaborar plano emergência município,Segurança
instituir brigada incêndio municipal eficiente,Segurança
implantar sistema vídeo monitoramento câmeras município,Segurança
articular através mídia local campanha educativa trânsito formar educação trânsito turma educadores rede municipal ensino diferentes escolas professores tornarão multiplicadores debate escolas trabalhando transversalidade temática estudantes utilizando linguagens tecnológica cênica,Segurança
implantar projeto sinalização vias,Segurança
buscar junto governo estado acesso cnh social,Segurança
fazer levantamento vias onde necessário instalar redutores velocidade lombadas/tartarugas diminuir possibilidades acidentes,Segurança
criar programa municipal trata sobre violência doméstica gênero bem sobre homofobia racismo inibindo causas socioculturais desse tipo deviolência tempo proporcionando espaço atendimento jurídico-psicossocial vítimas casas passagem,Segurança
manter ampliar estruturas conselho tutelar,Segurança
fazer campanha conscientização sobre proibição venda bebidas alcoólicas menores 18 intensificar fiscalização estabelecimentos visando coibir ilícito,Segurança
criar plano integrado enfrentamento crack drogas afins proponha integração articulação ampliação ações saúde assistência social segurança pública educação desporto cultura direitos humanos prevenção uso tratamento reinserção social usuários drogas contemplando participação familiares atenção público vulnerável,Segurança
instituir programa municipal disseminação cultura paz escola,Segurança
desenvolver ambiente escolar ações prevenção violência uso drogas,Segurança
promover palestras escolares envolvendo diretores professores pais alunos agentes segurança pública discutir problemas enfrentados escola,Segurança
realizar pesquisas identificar situações bullying escolas possam direcionar ações forma intensiva naquelas maior índice,Segurança
promover audiências públicas discutir buscar soluções problemáticarelacionada segurança pública,Segurança
instituir olho comunidade – cidadãos usando whatsapp denunciar atos suspeitos e/ou criminosos,Segurança
viabilizar projeto canalizar verbas construção espaço adequado funcionamento creche tempo integral sede município,Educação
priorizar investimentos projetos iniciativas pedagógicas instituições escolares,Educação
regularizar redefinir avaliação rede pública municipal prova sareme2 considerando dados resultados parâmetros proposição ações formação continuada servidores docentes gestores articulação estratégias aproximar famílias escolas,Educação
definição política municipal educação alcance metas âmbito alfabetização crianças sete 07 anos idade elevação índices participação média avaliações externas saeb3 consequentemente melhorar desempenho ideb4 ioeb5,Educação
definir estratégias eliminar horários ociosos durante período atividades letivas,Educação
equipar escolas oferecer capacitação docente profissionais interagirem processos tecnológicos práticas docentes,Educação
realizar busca ativa comunidades melhorar índices matrículas rede municipal mediante compromisso educação pública qualidade,Educação
atualizar projeto educação especial inclusiva instituindo política municipal centrada necessidades aprendizes,Educação
apoiar qualificação profissionais docentes quadro efetivo enquadrados atendimento alunos neurodiversos,Educação
discutir aquisição plataforma educacional virtual ferramentas ambientes aprendizagem interação acessíveis professores alunos/famílias,Educação
reformar unidades escolares estrutura física defasada ampliar unidades escolares atualmente encontram-se espaço insuficiente atender alunos matriculados,Educação
realizar concurso público preenchimento vagas remanescentes cargo efetivo professor rede pública ensino,Educação
promover educação inclusiva adequação instalações contratação profissionais apoio agenda capacitação profissional ensino libras ações acolhimento alunos promoção ações voltadas convívio social comunidade escolar diálogo estreito família,Educação
organizar eventos esportivos educacionais culturais escolas gincanas culturais torneios esportivos interclasses intercolegiais semanas culturais apresentações artísticas concursos educacionais redação português matemática demais matérias,Educação
promover constante avaliação educação profissionais educação valorização bem avaliados meio pagamento 14º salário apoio especialização,Educação
valorizar premiar excelência educação meio prêmios notebooks bicicletas outros apoio família melhores alunos vencedores concursos torneios desenvolvidos,Educação
promover debate acerca adoção ensino tempo integral rede municipal educação,Educação
desenvolver programas ensino técnico profissionalizante jovens voltado necessidades modernas emprego mídias digitais áudio vídeo informática outros,Educação
promoção melhoria estrutura física equipamentos escolas creches,Educação
garantia transporte digno eficiente estudantes deslocam povoados sede municipal buscando substituição frota ônibus escolares,Educação
realização cursos formação continuada professores,Educação
projetos intensificação melhoria educação básica,Educação
implantação programa informática escolas,Educação
ampliar número vagas educação infantil,Educação
reconstrução unidade escolar municipal “ severo eulálio ”,Educação
garantir manutenção qualidade merenda escolar,Educação
ampliar oferta ensino tempo integral,Educação
valorizar carreira profissionais integram quadro servidores rede municipal ensino,Educação
pagamento 60 sessenta porcento recursos oriundos precatório fundef professores rede fizerem jus,Educação
garantir vagas todas crianáas 0 5 ano rede municipal ensino promovendo pleno atendimento educandos creches prè-escolas,Educação
promover aperfeiçoamento todos profissionais rede municipal ensino adequar plano cargos salários profissionais educaçãoo fim garantir qualidade ensino melhoria qualidade vida sociedade,Educação
ampliar melhorar transporte escolar alunos rede municipal ensino atendimento todas localidades zona rural,Educação
garantir qualidade merenda escolar garantindo compra produtos agricultura familiar,Educação
garantir estudantes egressos ensino mèdio ingresso sistemas cursos tècnico superior outros municìpios suporte atravès transporte escolar,Educação
adequado aluguel casas apoio ofertas bolsas estudos,Educação
garantir distribuiçao fardamento todos estudantes rede municipal ensino,Educação
buscar parceria governo estadual federal ampliaçao oferta novos cursos uapi garantindo oferta ensino tècnico superior todos cidadoes cidadoes franciscomacedense,Educação
implantar escola tempo integral toda rede municipal ensino garantir polìtica nacional educaçao,Educação
valorizar profissionais educação,Educação
implementar padrões básicos infraestrutura física material pessoal escolas públicas,Educação
fortalecer programas formação continuada profissionais educação estabelecer bonificações méritos desempenho,Educação
implementar escola educação integral tempo integral em100 escolas turmas,Educação
ampliar fortalecer protagonismo juvenil estimulando monitorias chamados agentes educacionais articulando-os programas pagamento bolsas,Educação
ampliar quantidade centros interação escola família comunidade,Educação
ampliar fortalecer ações intersetoriais parcerias instituições públicas privadas,Educação
criar centro formação profissionais educação,Educação
implementar núcleo atendimento especializado pessoa deficiência domingos mourão,Educação
implementar reajustes superiores inflação forma diferenciada categoria magistério,Educação
implantar esportes olímpicos escolas judô,Educação
entregar kit irrigação cada escola rede municipal ampliadas ações projetos hortas escola,Educação
perfurar poços tubulares escolas implantar energia solar,Educação
implementar preparatório municipal enem,Educação
ofertar estudantes universitários casa apoio estudante municípios piripiri pedro ii,Educação
ampliar turmas robótica aulas informática educação financeira empreendedorismo através programa avança educação,Educação
ampliar acesso valorizar ensino profissionalizante buscando incentivar melhoria expansão ensino técnico serviços assistência técnica extensão rural,Educação
promover educação relações étnico raciais meio valorização diversidade etnicorracional cultural,Educação
reconhecer educação ambiental processo continuado permanente formal formal crítico participativo focado formação cidadania ativa favor sustentabilidade social,Educação
promover políticas ativas erradicação analfabetismo mulheres homens jovens adultos idosos,Educação
implantar programa alfabetiza domingos mourão tendo meta alfabetização 100 crianças redução analfabetismo jovens adultos idosos visando elevação escolaridade população,Educação
ampliar políticas bonificações alunos respectivos professores maior número medalhas certificados olímpiadas externas,Educação
aquisição mobiliários equipamentos informática,Educação
criar centros municipais educação infantil – cmeis infraestrutura adequada atendimento crianças educação infanti tempo integral creche pré – escola,Educação
melhorar ampliar frota transporte escolar garantindo conforto segurança estudantes,Educação
