Proposta,Eixo
angariar recursos meio emendas contenção gastos aquisição veículos uso exclusivo área saúde,Saúde
desenvolver ação sanar filas unidades saúde,Saúde
proporcionar melhorias atendimento médicos oferta exames ultrassom raio-x farmácia básica,Saúde
implementar programas atendam pessoas apresentem dificuldades temporárias definitivas sair casa chegar unidade saúde ainda pessoas necessitam aten dimento domiciliar,Saúde
implementar projetos programas saúde pública prevenção atendam todo cidadão desde gestação terceira idade,Saúde
pactuar programas condizentes realidade município,Saúde
reativar programa brasil sorridente equipe saúde bucal próteses dentárias,Saúde
viabilizar convênios atendimentos especializados ginecologista pediatra neurologista psiquiatra urologista,Saúde
aquisição ambulâncias tanto sede localidades maior fluxo populacional município,Saúde
pactuar parcerias oftalmológicas minimizar gastos provenientes custos anuais,Saúde
implantar centro atendimento crianças atípicas,Saúde
implantar programa “ remédio casa ” diabéticos hipertensos cadastrados rede municipal residência fixa município,Saúde
construir unidades básicas saúde emparedada vila mel,Saúde
criar pontos apoio atendimento saúde duas localidades,Saúde
disponibilizar profissional capacitado ato deslocamento pacientes somente motorista,Saúde
manter casa apoio enfermos carro motorista assistente doméstico “ auxiliar gestor saúde ” guia tanto teresina implantar sistema picos,Saúde
implantar médico 24 horas município,Saúde
priorizar ações promoção prevenção saúde individual coletiva,Saúde
ampliar acesso serviços saúde,Saúde
reduzir agravos saúde população relativos atenção básica,Saúde
melhorar resolutividade serviços saúde,Saúde
implantar ações específicas atendimento mulher criança,Saúde
priorizar atendimentos campanhas voltadas saúde homem,Saúde
implementar tecnologias melhorar assistência sanitária fortalecer vigilância sanitária epidemiológica ambiental,Saúde
articular ações saúde ações melhoria condições ambientais,Saúde
colocar profissionais promovam qualidade vida psf exemplo atividades físicas,Saúde
expandir estruturar equipes saúde bucal ampliando cobertura serviço 100 2028 parceria governo federal implementar ações tratamento canal outros serviços especializados,Saúde
monitorar cobertura vacinas grupos prioritários crianças idosos possam atendidos rapidez eficácia,Saúde
ampliar rede atenção mulheres crianças adolescentes situação risco saúde,Saúde
expandir ações planejamento familiar meio ampliação acesso métodos anticoncepcionais,Saúde
ampliar estruturar serviços saúde mental,Saúde
construir reformar reestruturar unidades básicas saúde-ubs postos saúde município,Saúde
fazer parcerias atendimento usuários álcool drogas hospitais gerais rede estadual credenciados,Saúde
garantir atendimento humanizado mulheres crianças vítimas violência,Saúde
qualificar pessoas atendimento humanizado idosos portadores necessidades especiais,Saúde
promover ações educação saúde,Saúde
agilizar coleta resultados exames câncer colo útero,Saúde
buscar junto rede estadual conveniada aumento oferta exames média alta complexidade município,Saúde
promover campanhas combate dengue zika chicungunha covid-19,Saúde
apoiar saúde gestantes através ações programa saúde família integrado profissionais nasf,Saúde
ampliar programa telessaúde acesso maior número especialistas,Saúde
implantar serviço atendimento móvel urgência samu,Saúde
desenvolver ações prevenção promoção saúde trabalhador,Saúde
adquirir veículos equipados emergências,Saúde
atendimento domiciliar idoso,Saúde
campanhas itinerantes atendimento saúde todos povoados,Saúde
promover melhorias estrutura física equipamentos serviços postos saúde garantindo via parceria estado atendimento preventivo saúde toda população morrense,Saúde
programa capacitação continua profissionais atuantes saúde visando prevenção doenças sexualmente transmissíveis cânceres comuns,Saúde
cursos intensivos capacitação atuação agentes saúde agentes endemias,Saúde
melhoria distribuição gratuita medicamentos doenças pressão alta diabetes colesterol outros – farmácia básica,Saúde
recuperação estrutura equipamentos saúde postos existentes apresentarem mau estado conservação e/ou serviços deficitários,Saúde
reduzir tempo espera consultas médicas postos saúde prefeitura,Saúde
equipar postos saúde estrutura básica realização exames,Saúde
contratação profissionais saúde médicos dentistas fisioterapeutas nutricionistas fonoaudiólogos etc,Saúde
saude,Saúde
construção equipagem prontos-socorros modernos capacidade atendimento alta complexidade,Saúde
contratação capacitação profissionais saúde,Saúde
parcerias universidades centros pesquisa aprimorar atendimento médico,Saúde
promover cursos aperfeiçoamento profissionais área saúde,Saúde
melhorar prontuário eletrônico cidadão – pec,Saúde
promover atendimento médico 24 horas incluindo sábados domingos,Saúde
viabilizar equipes multiprofissionais semanalmente localidades – aliança gurguéia agrovila estreito olho d ́agua mato lagoa cercada solta,Saúde
ampliar atendimentos odontológicos sede zonas rurais município,Saúde
aquisição ambulância localidade lagoa cercada aliança gurguéia,Saúde
revitalizar atividades voltadas idosos hidroginástica atividades físicas orientação terapêuticas sede zona rural,Saúde
viabilizar aquisição máquina raio-x ubs – unidade básica saúde 4,Saúde
aquisição casa apoio equipe acompanhamento tratamento saúde teresina – pi,Saúde
viabilizar farmacêutico farmácia básica,Saúde
implantar saúde digital,Saúde
promover assistência eletiva especialidades saúde,Saúde
fornecer principais medicamentos urgência através farmácia básica sede localidades rurais,Saúde
aquisição veículos atender demandas secretaria saúde,Saúde
viabilizar aquisição motocicletas agentes zoonose,Saúde
promover ações envolvendo toda comunidade objetivando combate gravidez precoce uso álcool adolescentes,Saúde
celebrar convênio estado/ união implantação rede esgoto estação coleta tratamento principais vias cidade,Saúde
viabilizar construção sumidouros fossa séptica,Saúde
revitalizar laboratório análise clinicas contratação profissionais funcionamento,Saúde
viabilizar curso aperfeiçoamento conselheiros municipais saúde,Saúde
promover contratação profissionais saúde psicólogos farmacêuticos nutricionistas técnicos enfermagem etc,Saúde
promover plano ação direcionamento lixo hospitalar resíduos sólidos,Saúde
reestruturar rede assistência saúde,Saúde
assegurar equilíbrio financeiro fundação municipal saúde,Saúde
ampliar hospital urgência teresina hut,Saúde
aperfeiçoar central regulação marcação consultas,Saúde
exames internações,Saúde
fortalecer estratégia programa saúde família prevenção promoção assistência saúde,Saúde
ampliar ações redução mortalidade materna infantil,Saúde
aperfeiçoar serviços assistência saúde mental,Saúde
tornar teresina cidade modelo combate catarata câncer colo útero câncer mama,Saúde
retomar projeto inseminação artificial,Saúde
ampliar descentralizar ações atendimento crianças adolescentes rede municipal ensino dificuldades aprendizagem,Saúde
fortalecer central laudos reorganizar fluxo pacientes ampliar oferta exames imagem,Saúde
ampliar oferta serviços odontológicos básicos especializados unidades básicas saúde,Saúde
revitalizar fortalecer atribuições vigilância sanitária centro zoonoses,Saúde
valorizar participação controle social,Saúde
policlínica todos exames complexo existem exames imagens endoscopia outros complexo,Saúde
vamos fazer 4 unidades pronto atendimento upa cidade todos profissionais especialidades medicina vamos fazer duas upa zona rural saúde grande evolução,Saúde
vamos ampliar médico família atender casa situação vulnerável,Saúde
vamos treinar agentes saúde fazer testes detectar doença residência conversar pessoa procurar tratamento imediato,Saúde
fortalecimento programa médicos,Saúde
incluir médicos especialistas atendimento,Saúde
buscar profissionais médicos residir município possam prestar atendimento rápido,Saúde
ampliação atendimento médico outros povoados,Saúde
povoados amplamente beneficiados atendimento equipe saúde visando facilitar diagnósticos acompanhamento problemas saúde população,Saúde
atenção especial munícipes condições especiais enfermidades limitam locomoção atendidos residências periodicidade dignidade,Saúde
cumprimento integral normas programas sus atendimento cidadãos utilizam serviços públicos saúde município,Saúde
criar programa sos saúde onde disponibilizado número telefone whatsapp pessoas sempre plantão autorizar imediatamente saída carro socorro,Saúde
promover dias dedicados saúde trabalhadores rurais visitas equipes saúde—incluindo médicos enfermeiros psicólogos dentistas—às comunidades ações visam alcançar muitas vezes sentem intimidados buscar atendimento médico garantindo todos acesso cuidados necessários,Saúde
manter programas qualidade atendimento pacientes município,Saúde
manter melhorar/ampliar fornecimento consultas medicamentos exames transporte pacientes,Saúde
manter ampliar ações programa nasf composto psicólogos fisioterapeutas fonoaudiólogos nutricionista educador físico dentistas outros,Saúde
manter sistema atendimento médicos especialistas,Saúde
melhorar ampliar frota veículos ambulâncias,Saúde
ampliar atendimento unidades saúde horários ampliados profissionais saúde maiores especialidades,Saúde
monitorar avaliar sistematicamente indicadores sistema saúde,Saúde
ampliar serviços equipes vigilância sanitária,Saúde
ampliar cobertura programa agente comunitário saúde estratégia saúde família,Saúde
adquirir unidade móvel adaptada ampliação atendimento saúde área rural,Saúde
ampliar caps centro atenção psicossocial álcool outras drogas implantar atendimento 24 horas,Saúde
construção centro referência idoso – oferecer atendimento especializado referenciado unidades saúde,Saúde
estruturar organizar funcionamento ceo centro especialidade odontológica,Saúde
reorganizar unidades básicas saúde caps nasf,Saúde
construções novas unidades básicas saúde caps nasf,Saúde
construção sede própria secretaria municipal saúde,Saúde
construção duas unidades saúde além reformas existentes,Saúde
construção/ampliação unidade saúde marrecas consultório odontológico,Saúde
ampliação atendimento médico especializado,Saúde
implantar saúde digital telemedicina todas unidades saúde,Saúde
renovação frota samu,Saúde
aquisição novas ambulâncias básicas,Saúde
ampliação serviços centro especializado saúde mulher criança,Saúde
aquisição microônibus transporte paciente teresina tratamento domicílio,Saúde
renovação carros equipes saúde família zona rural,Saúde
aquisição carro próprio vigilância ambiental transporte equipe visitas domiciliares,Saúde
construção sede própria caps,Saúde
viabilizar termo cooperação estado transferência maternidade hospital estadual teresinha nunes barros,Saúde
implementação insalubridade profissionais saúde •capacitação continuada profissionais saúde garantir qualidade atendimentos,Saúde
ampliação atendimento psicológico postos saúde,Saúde
utilizar espaços públicos bairros realizar atividade física pacientes idosos obesos doenças crônicas outros,Saúde
promover campanhas saúde promoção prevenção escolas demais espaços públicos,Saúde
melhorar infraestrutura saúde,Saúde
capacitação profissionais saúde,Saúde
reorganizar unidade básica saúde estruturando-a infraestrutura humana material equipamentos insumos capazes estabelecer garantia funcionamento eficaz,Saúde
melhoria manutenção ampliação esf estratégias saúde família,Saúde
instituir programa “ academia saúde ” – promovendo assim atividades saúde bem-estar população,Saúde
implementar ações saúde voltadas mulher gestante criança adolescente bem ações voltadas saúde homem,Saúde
aquisição ambulância equipada situações emergência,Saúde
adquirir transporte condutores exclusivos viagens capital estado contemplando diversas demandas secretaria municipal saúde,Saúde
desenvolver trabalho contínuo combate dengue chikungunia zika município,Saúde
distribuição gratuita medicamentos doenças pressão alta diabetes colesterol outros,Saúde
assegurar melhoria atendimento humanização rede saúde pública garantindo conduta atenção cuidado atenda efetivamente expectativa população,Saúde
aumento frota ambulâncias visando facilitar deslocamento enfermos residentes,Saúde
sede povoados,Saúde
ampliar financiamento recursos federais ações atenção primária saúde,Saúde
garantia melhoria acesso serviços redes públicas sáude,Saúde
ampliaçao contrataçao serviços especializados atendimento médico hospitalar,Saúde
continuidade projeto melhoria ubs promover melhorias estrutura física equipamentos serviços garantindo atendimento preventivo saúde toda população precisa,Saúde
programa capacitação continua profissionais atuantes saúde visando prevenção doenças sexualmente transmissíveis cânceres comuns,Saúde
capacitação atuação agentes saúde agentes endemias,Saúde
distribuição gratuita medicamentos doenças pressão alta diabetes colesterol outros,Saúde
recuperação estrutura equipamentos saúde postos saúde,Saúde
promoção campanhas itinerantes todos povoados voltadas exames oftalmológicos diabéticos ginecológicos urológicos,Saúde
criação padi programa atendimento domiciliar idoso,Saúde
melhorar distribuiçao gratuita medicamentos parcceria governo federal estadual,Saúde
ampliar atendimento especialidades centro saúde,Saúde
manter programas projetos funcionamento atualmente,Saúde
adquirir ultrassom centro saúde,Saúde
pleitear junto demais esferas governo ampliação parcerias busca recursos município,Saúde
promover capacitações servidores profissionais saúde fim garantir melhoria humanização atendimento rede saúde pública assegurando postura atenção cuidado responda afetivamente expectativa população,Saúde
aquisição veículos apoio,Saúde
aparelhar conselho municipal saúde fortalecendo democratizando,Saúde
controle social território saúde município,Saúde
implantar redes assistência saúde saúde mental psicossocial idoso urgência/emergência atendimento pacientes portadores necessidades especiais adoção linhas cuidado protocolos atendimento,Saúde
implantar sistema remuneração salarial servidores saúde baseado gestão resultados meio indicadores saúde,Saúde
implantar núcleo formação serviços saúde servidores secretaria saúde meio formalização convênios união estado,Saúde
ampliar equipes atendimento psf programa saúde família,Saúde
implantar e/ou ampliar linha saúde área rural município,Saúde
renovar frota ambulâncias transportes eletivos,Saúde
viabilizar mutirões procedimentos cirúrgicos eletivos ambulatoriais,Saúde
integrar todos sistemas informatizados unidades serviços setores,Saúde
implantar coleta dados informatizada agentes comunitários saúde agentes endemias meio computadores portáteis palmtop,Saúde
implantar sistema comunicação via sms mensagem celular pacientes agendamento consultas resultados exames outros serviços combatendo assim demora longas filas,Saúde
estruturar setor engenharia clínica sistema informatizado compreendendo gerenciamento acervo patrimonial planejamento manutenção preventiva corretiva todos equipamentos,Saúde
construir reformar ampliar unidades básicas saúde município,Saúde
elaborar projeto destinar área implantação hospital municipal conjunto estado união,Saúde
criar e/ou fortalecer conselho municipal políticas públicas combate drogas,Saúde
criar cetrad centro tratamento dependentes álcool drogas,Saúde
iniciar atendimento dependentes químicos principalmente meio cetrad centro tratamento dependentes álcool drogas,Saúde
aquisição novos equipamentos aparelhos consultório odontológico ubs unidade básica saúde félix piauí,Saúde
implantação samu serviço atendimento móvel urgência município,Saúde
implantar nova esf – equipe saúde família,Saúde
ofertar médicos especialistas dentro próprio município exemplo psiquiatra pediatra ortopedista ginecologista cirurgião geral,Saúde
implantar centro terapia pessoas comtranstorno espectro autista,Saúde
realizar exames imagem unidade mista saúde antônio batista exemplo raio-x ultrassom,Saúde
valorizar todos profissionais atuam saúde independentemente categoria profissional pilares dessa transformação,Saúde
reorganizar ampliar fortalecer programa estratégia saúde família esf interior sede município,Saúde
ampliação programa nasf composto médica ginecologista fonoaudiólogo nutricionista educador físico fisioterapeuta,Saúde
reorganizar ampliar programa saúde bucal,Saúde
desenvolver melhorar programas atenção idoso saúde mulher saúde criança adolescente,Saúde
efetivar disponibilidade médicos enfermeiros plantonistas atendimento hospitalar,Saúde
compra novas ambulâncias modernas preparadas atender casos emergência local durante encaminhamento hospital,Saúde
aquisição veículo deslocamento equipe saúde zona rural,Saúde
intensificar campanhas vacinação crianças idosos melhorando qualidade vida população,Saúde
construção implantação 01 laboratório realização exames básicos município população possa atendida gratuitamente,Saúde
construção maternidade onde todas mulheres paulistanense possam ter direito filho nascimento paulistana,Saúde
construção ampliação novas unidades básicas saúde,Saúde
assegurar cobertura todos medicamentos preconizados ministério saúde distribuídos gratuitamente farmácia básica entrega domicilio usuários hipertensos diabéticos,Saúde
capacitação profissionais agentes saúde melhor atendimento população humanização função,Saúde
assegurar cidadãos acesso informações participação formação implementação avaliação políticas saúde,Saúde
ampliar serviços equipe vigilância sanitária,Saúde
melhorar qualidade atendimento agentes endemias agentes comunitário saúde,Saúde
manutenção ampliação serviços distribuição medicamentos através farmácia básica,Saúde
implantação projeto caravana saúde atendimento localidades,Saúde
capacitar profissionais melhorando qualidade serviço saúde,Saúde
melhorar condições trabalho profissionais saúde transportes infraestrutura salário etc,Saúde
finalização obra unidade básica avançada saúde – ubas garantindo as-sistência 24 horas,Saúde
ativação reorganizar serviço atendimento móvel urgência – samu,Saúde
segurança pública possui alicerces principais aliança comunitária transparência cuidado pessoas grupos temáticas sensíveis reeducandos crianças mulheres idosos deficientes meio ambiente dentre outros apoio profissionais refletindo modo social fazer segurança palavras-chave,Segurança
viabilizar apoios maior aproximação comunidade meio conselhos segurança rondas visitas comunitárias,Segurança
promover reforço efetivo policiamento município,Segurança
apoiar classe policial município,Segurança
revitalizar apoiar ações conselho municipal segurança implantação programas voltados,Segurança
valorização apoio ações conselho tutelar conselheiros,Segurança
viabilizar firmar parceria secretaria estadual segurança bom funcionamento companhia polícia militar,Segurança
implantar sistema monitoramento através instalação câmeras torres observação principais vias acesso enviarão imagens toda cidade tempo real central guarda municipal,Segurança
implementar convênio estado aumento efetivo polícia civil militar reestudo convênio segurança trânsito,Segurança
ampliar consolidar programas ações garantam segurança população,Segurança
criação guarda municipal,Segurança
valorização preservação patrimônio público instalação sistemas videomonitoramento principais vias acesso cidade praças prédios públicos câmeras enviarão imagens tempo real central guarda municipal,Segurança
implantação vigilância comunitária localidades populosas,Segurança
apoio através convênio junto policias civil militar combate infrações contravenções crimes município angical piauí,Segurança
solicitação implantação companhia independente polícia militar município,Segurança
garantir iluminação pública qualidade toda cidade melhor atuação polícia militar maior conforto segurança moradores,Segurança
instalar câmeras segurança enviarão imagens toda cidade tempo real policia militar,Segurança
implementar convênio estado aumento efetivo policia militar através convênio estado,Segurança
implantar política municipal integrada prevenção violência cultura paz cidade iniciativas mediação conflitos comunidades miguel tapuio,Segurança
implantar sistema monitoramento prédios públicos garantir maior segurança,Segurança
criar guarda municipal atuação organizada monitorada diariamente,Segurança
realizar parceria governo estado reforma restruturação sede polícia militar localizado rua coletor josé araújo,Segurança
produzir publicar materiais eventos campanhas tratar temas relacionados enfrentamento machismo feminicídio translesbofobia violência contra mulheres empoderamento público feminino,Segurança
seguranca,Segurança
promoção campanhas educativas institucionais área segurança pública segurança trânsito combate uso drogas outros promovendo incentivando ações estratégicas prevenção violências,Segurança
planejamento ações conjuntas vara infância juventude,Segurança
promover cooperação articulação órgãos federais estaduais municipais vistas alcance metas estabelecidas objetivos,Segurança
política nacional segurança pública defesa social,Segurança
implementar políticas segurança pública prevenção enfrentamento criminalidade maneira integrada entes federativos estaduais forma estabelecida plano nacional segurança pública defesa social 2021-2030,Segurança
criar sistema integrado câmeras segurança videomonitoramento perímetro urbano sala controle operacional permite acompanhamento tempo real todos dias durante 24h principais pontos cidade qualificando processos investigação inteligência,Segurança
ampliação ações prevenção criminal meio videomonitoramento,Segurança
sistema monitoramento através câmeras pontos estratégico zona urbana,Segurança
atuar forma integrada conselho tutelar,Segurança
aumentar efetivo policial sede município,Segurança
implantação guarda municipal,Segurança
buscar recursos junto governo estadual compra veículos segurança,Segurança
buscar ampliação número policiais gpm itainópolis junto governo estado,Segurança
atuar preventivamente combate tráfico drogas fortalecendo presença gpm,Segurança
atuar especialmente região escolas maior proteção crianças adolescentes dentro recinto,Segurança
atuar proteção guarda patrimônio histórico próprios municipais recursos naturais,Segurança
enfrentar criminalidade violência endêmica parceria governo,Segurança
estado gerando sensação segurança tranquilidade,Segurança
proporcionar ações imediatas segurança cidadão,Segurança
implantar política segurança pública integrada articulada demais políticas públicas,Segurança
proteger patrimônio público,Segurança
definir programa parceria estado compartilhar responsabilidades segurança pública promoção justiça proteção cidadão dentro respectivas áreas atuação,Segurança
melhoria iluminação pública prioridade recuperação todo sistema iluminação município retomada equipe servidores realização desses serviços caráter emergencial,Segurança
criação guarda municipal efetivo inicial homens mulheres cuja função deverá prioritariamente guarda patrimônios municipais segurança escolas etc,Segurança
solicitar aumento contingente polícia militar,Segurança
implementação iluminação led todo município,Segurança
implantação central monitoramento câmeras centro entradas cidade,Segurança
manter politicas voltadas combate violência urbana articuladas setores organizados sociedade policias militar civil,Segurança
apoio policia militar combate violência roubos furtos,Segurança
criação programa incentivo jovem dependente químico atuar rigor visando cumprimento estatuto criança adolescente proibição drogas parceria governo federal estadual,Segurança
aquisiçao novas viaturas atender serviços guarda municipal,Segurança
buscar formalizaçao convenios senasp secretaria estadual segurança obtençao equipamentos uso pessoal coletivo tais coletes algemas spray pimenta epis armas letais taser,Segurança
ampliar sistema municipal videomonitoramento ja existentes instalaçao cameras repartiçoes município vias publicas,Segurança
instalar cameras principais saídas município,Segurança
aquisiçao novos equipamentos guarda municipal agentes transito,Segurança
capacitaçao continuada cursos treinamentos,Segurança
reestruturar patrulha escolar articulando guarda civil municipal escolas,Segurança
concurso publico aumento efetivo guarda civil municipal,Segurança
plano cargos carreira sala rios – pccs guarda municipal agentes transito,Segurança
continuidade projeto guarda mirim,Segurança
elaboraçao pano municipal segurança publica,Segurança
criar estacionamento rotativo rea centro comercial cidade rea adjacente,Segurança
