Proposta,Eixo
SOLICITAÇÃO DE IMPLANTAÇÃO DE UMA COMPANHIA INDEPENDENTE DA POLÍCIA MILITAR NO MUNICÍPIO.,Segurança
Garantir iluminação pública de qualidade em toda a cidade para uma melhor atuação da polícia militar e um maior conforto e segurança dos moradores;,Segurança
"Instalar  câmeras  de  segurança,  que  enviarão  imagens  de  toda  cidade  em  tempo  real para policia militar;",Segurança
"Implementar  convênio  com  o  Estado  para  o  aumento  de  efetivo  da  Policia  Militar, através de  convênio com o Estado;",Segurança
"Implantar  a  Política  Municipal  Integrada  de  Prevenção  à  Violência,  a cultura  de  paz  na  cidade  e  as  iniciativas  de  mediação  de  conflitos  nas comunidades de São Miguel do Tapuio;",Segurança
Implantar do Sistema de Monitoramento nos prédios públicos para garantir maior segurança;,Segurança
Criar a Guarda Municipal com atuação organizada e monitorada diariamente;,Segurança
Realizar parceria com o Governo do Estado para reforma e restruturação da Sede da Polícia Militar localizado na Rua Coletor José de Araújo;,Segurança
"Produzir e publicar materiais, eventos e campanhas para tratar de temas relacionados ao enfrentamento do machismo, do feminicídio, da translesbofobia e da violência contra as mulheres e ao empoderamento do público feminino;",Segurança
Seguranca,Segurança
"Promoção de campanhas educativas institucionais na área da segurança pública (segurança no trânsito, combate ao uso das drogas, entre outros) promovendo e incentivando ações estratégicas de prevenção às violências",Segurança
Planejamento de ações conjuntas com a Vara da Infância e Juventude;,Segurança
"Promover a cooperação e a articulação entre os órgãos federais, estaduais e municipais  com  vistas  ao  alcance  das metas  estabelecidas  e os objetivos da",Segurança
Política Nacional de Segurança Pública e Defesa Social;,Segurança
"Implementar  políticas  de  segurança  pública,  prevenção  e  enfrentamento  à criminalidade, de maneira integrada com os entes federativos e estaduais, na forma estabelecida no Plano Nacional de Segurança Pública e Defesa Social 2021-2030.",Segurança
"Criar Sistema Integrado com câmeras de segurança para videomonitoramento no perímetro urbano, com sala de controle operacional, que permite o acompanhamento  em  tempo  real,  todos  os  dias,  durante  24h,  nos  principais pontos da cidade, qualificando os processos de investigação e inteligência;",Segurança
Ampliação das ações de prevenção criminal por meio de videomonitoramento.,Segurança
Sistema de monitoramento através de câmeras em pontos estratégico na zona urbana;,Segurança
Atuar de forma integrada com o Conselho Tutelar;,Segurança
Aumentar o efetivo policial para sede do município;,Segurança
Implantação de Guarda Municipal;,Segurança
Buscar  recursos  junto  ao  Governo  Estadual  para  a  compra  de  veículos para a segurança.,Segurança
Buscar a ampliação do número de policiais no GPM de Itainópolis junto ao governo do Estado.,Segurança
"Atuar preventivamente no combate ao tráfico de drogas, fortalecendo a presença da GPM;",Segurança
"Atuar especialmente na região das escolas, para maior proteção de nossas crianças e adolescentes, dentro e fora do recinto;",Segurança
"Atuar na proteção e guarda de nosso patrimônio histórico, próprios municipais e recursos naturais;",Segurança
Enfrentar  a  criminalidade  e  a  violência  endêmica  em  parceria  com  o  Governo  de,Segurança
"Estado, gerando sensação de segurança e tranquilidade;",Segurança
Proporcionar ações imediatas de segurança ao cidadão;,Segurança
Implantar  uma  política  de  segurança  pública  integrada  e  articulada  com  as  demais políticas públicas;,Segurança
Proteger o patrimônio público;,Segurança
"Definir  um  programa  de  parceria  com  o  estado  para  compartilhar  responsabilidades com a segurança pública, promoção da justiça e a proteção do cidadão, dentro de suas respectivas áreas de atuação;",Segurança
Melhoria da iluminação pública com prioridade para a recuperação de todo sistema de iluminação no municÍpio e retomada de equipe de servidores para a realização desses serviços em caráter emergencial;,Segurança
"Criação da Guarda Municipal (com efetivo inicial, de homens e mulheres), cuja função deverá ser, prioritariamente, a guarda de Patrimônios Municipais, segurança de escolas, etc.;",Segurança
Solicitar o aumento do contingente da Polícia Militar;,Segurança
Implementação de iluminação em Led em todo município.,Segurança
Implantação  de  uma  central  de  monitoramento  com  câmeras  no  centro  e entradas da cidade.,Segurança
"Manter as politicas voltadas ao combate a violência urbana, articuladas com os setores organizados da sociedade e com as policias militar e civil.",Segurança
"Apoio a Policia Militar no combate à violência, roubos e furtos;",Segurança
Criação de um programa de incentivo ao jovem dependente químico e atuar com rigor visando o cumprimento do Estatuto da Criança e do Adolescente na proibição de drogas em parceria com o governo Federal e Estadual.,Segurança
Aquisiçao de novas viaturas para atender os serviços da Guarda Municipal;,Segurança
"Buscar a formalizaçao de convenios com a SENASP e a Secretaria Estadual de Segurança para obtençao de equipamentos de uso pessoal e coletivo, tais como: coletes, algemas, spray de pimenta, EPIs, armas na o letais (Taser);",Segurança
Ampliar o sistema municipal de videomonitoramento ja  existentes com instalaçao de mais cameras nas repartiçoes do município e vias publicas;,Segurança
Instalar cameras nas principais saídas do município;,Segurança
Aquisiçao de novos equipamentos para a Guarda Municipal e Agentes de Transito;,Segurança
Capacitaçao continuada com cursos e treinamentos;,Segurança
"Reestruturar a Patrulha Escolar, articulando Guarda Civil Municipal e escolas;",Segurança
"Concurso publico, para o aumento efetivo da Guarda Civil Municipal;",Segurança
"Plano de Cargos, Carreira e Sala rios – PCCS da Guarda Municipal e Agentes de Transito;",Segurança
Continuidade do Projeto Guarda Mirim;,Segurança
Elaboraçao do Pano Municipal de Segurança Publica;,Segurança
Criar o Estacionamento Rotativo na a rea do centro comercial da cidade e a rea adjacente;,Segurança
Promover a central de monitoramento remoto para maior rapidez e eficacia das açoes atraves de alta,Segurança
"tecnologia: camaras, drones, radios comunicadores, mapas estrate gicos de posicionamento de patrulhas",Segurança
em todo o territorio;,Segurança
"Ampliar o sistema municipal de vídeo monitoramento, integrando sistemas ja  existentes pu blicos e",Segurança
"privados, ampliando para as areas definidas em comum acordo com os conselhos de segurança municipal",Segurança
priorizando os pontos de maior insegurança nos bairros;,Segurança
Instituir o Projeto Luzilandia Segura;,Segurança
"Treinamento, aperfeiçoamento e padronizaçao das aço es da Guarda Civil de Luzilandia, a fim de auxiliar a",Segurança
Polícia Militar do Piauí  ao combate a  criminalidade na cidade de Luzila ndia;,Segurança
"Implantaça o do Projeto Guarda Armada, apos uma minuciosa preparaçao e seleça o por meio de Teste",Segurança
"Psicologico em açao conjunta com a Policia Militar do Piauí , Polícia Federal e demais Forças de Segurança.",Segurança
Criação do centro de monitoramento com implantação de câmeras nas principais ruas e avenidas da cidade;,Segurança
Ampliar os serviços de segurança com rondas na zona urbana e rural do município;,Segurança
Criar o plano municipal de segurança pública;,Segurança
Realizar monitoramento e manutenção de Infraestruturas Públicas;,Segurança
"Implementar programa de monitoramento contínuo das infraestruturas públicas,  utilizando  tecnologias  de  vigilância  e  inspeções  regulares  para  prevenir vandalismos e danos;",Segurança
Criar Plano de Segurança para Patrimônio Histórico e Cultural:,Segurança
"Desenvolver plano de segurança específico para proteger o patrimônio histórico e cultural do município, incluindo treinamento da Guarda Municipal em técnicas de preservação  e resposta rápida a incidentes;",Segurança
Promover Integração do Trânsito à Secretaria de Segurança Pública:,Segurança
"Transformar  a  Secretaria  Municipal  de  Segurança  Pública  em  “Secretaria Municipal  de  Segurança  Pública  e  Mobilidade”,  integrando  as  funções  de trânsito, visando melhorar a mobilidade urbana e reduzir acidentes;",Segurança
Potencializar campanhas educativas no Trânsito visando melhorar a mobilidade urbana e reduzir acidentes;,Segurança
"Investir  na  compra  de  EPIs  modernos  para  toda  a  corporação  da  guarda municipal, garantindo a segurança  durante as operações;",Segurança
Ampliar Sistema de Vídeo e Monitoramento;,Segurança
Implementar um programa de policiamento comunitário;,Segurança
Estabelecer  um  Centro  Integrado  de  Comando  e  Controle  -  CICC  para coordenar as ações de segurança;,Segurança
"Desenvolver  projetos  sociais  em  áreas  de  alta  vulnerabilidade,  oferecendo atividades  culturais,  esportivas  e  educativas  para  jovens,  visando  afastá-los  da criminalidade;",Segurança
"Apoiar as ações de fiscalização e combate a crimes ambientais, promovendo a proteção das áreas verdes e de preservação do município;",Segurança
"Implementar operações especificas contra o tráfico de drogas, com patrulhamento  intensivo  em  áreas  de  risco  em  parceria  com  forças  estaduais  e federais para desarticular redes criminosas;",Segurança
"Desenvolver  programa  abrangente  de  prevenção  à  criminalidade,  incluindo ações educativas para jovens;",Segurança
"Promover  cursos  de  capacitação    e  aperfeiçoamento  sobre  técnicas  de atendimento  aos  diferentes  locais  de  crime,  tendo  como  destaque  locais  públicos  e repartições públicas;",Segurança
Dar subsídio à Polícia Militar de acordo com a demanda;,Segurança
"Revitalizar  convênio  com  o  Pronasci  (Programa  Nacional  de  Segurança  Pública), do  Ministério  da  Justiça  e  Segurança  Pública,  visando  implantar  projetos  que articulem políticas de segurança a ações sociais preventivas e direcionadas prioritariamente às causas da violência;",Segurança
"Criar projetos em parcerias com a Polícia Militar, Polícia Civil, Ministério Público, Conselho Tutelar, Assistência Social, Saúde, Educação, etc., visando o cumprimento  do  Estatuto  da  Criança  e  Adolescente  na  proibição  de  venda  de bebidas alcoólicas, armas e outros produtos para menores de 18 anos;",Segurança
"Criar  o  programa  Vizinhança  Solidária,  com  o  objetivo  de  prevenir  os  atos  de desrespeito à convivência, procurando agir coletivamente nas comunidades.",Segurança
"Criação de rede de apoio para os dependentes químicos, em parceria com estados e entidades do Terceiro Setor, como instrumento de auxílio para  as  famílias  que  hoje  não  têm  informações  sobre  onde  nem  como obter ajuda. Essa rede viabilizará a execução de um programa de oferta de  local  de  tratamento  de  dependentes  de  drogas,  com  serviços  de referência aos usuários.",Segurança
"Instituição  de  política  de  incentivo  e  apoio  para  oferta  de  atenção psicossocial  aos  usuários  de  álcool  e  drogas,  permitindo  ações  de promoção e prevenção, de assistência, e de inserção social para dependentes químicos e seus familiares.",Segurança
"Desenvolvimento  de  um  programa  municipal  de  prevenção  ao  uso abusivo  de  álcool  e  outras  drogas,  em  parceria  com  estados,  união  e entidades do Terceiro Setor, priorizando os jovens, com ações nas áreas de cultura, lazer e esportes.",Segurança
"Identificação  dos  pontos  mais  vulneráveis  de  uso  de  drogas  no Município,  garantindo  apoio  para  transformar  esses  pontos  em  áreas livres de drogas.",Segurança
Apoio  a  projetos  de  educação  e  formação  profissional  em  tempo integral nas áreas de maior vulnerabilidade em relação à segurança.,Segurança
Apoio total a Polícia Militar através de parceria entre estado e município.,Segurança
"Implantação, em parceria com Estados de programas de prevenção a acidentes de trânsito.",Segurança
"Garantir  a  permanência  da  Segurança  Pública  para  todos  os  cidadãos  e  cidadãs  s,  e igualmente  a  todos  os  que  adentrarem  no  Município  de  São  Julião  e  em  suas  respectivas Adjacências;",Segurança
Zelar pela permanência da Ordem Social em todos os Segmentos Públicos e Privados;,Segurança
"Manter  comunicação  constante  com  os  profissionais  que  atuam  na  Segurança  Pública, garantindo, através destes, a permanência da Ronda Policial e todo trabalho de Segurança para manter a paz social;",Segurança
Firmar parceria com órgãos do governo estadual para a seleção de agentes para formação de uma brigada ambiental.,Segurança
"Definir  como  responsabilidade  do  estado  a  segurança  e  manutenção  da ordem pública nos espaços, prédios e dos eventos que demandam à participação coletiva e condições de segurança.",Segurança
Traçar  parcerias  entre  a  brigada  ambiental  e  força  policial  estadual  para rondas ostensivas em locais  considerados críticos e/ou vulneráveis.,Segurança
"Garantir iluminação pública de qualidade em toda a cidade, para melhor atuação da polícia militar e mais conforto e segurança aos moradores;",Segurança
"Manutenção e ampliação de câmeras em torres de observação nas principais vias de acesso, que enviarão imagens de toda cidade em tempo real para uma central da Guarda Municipal;",Segurança
"Parceria com o Governo do Estado para controle e segurança no trânsito, por meio efetivo do uso de equipamentos de segurança;",Segurança
Aprimorar a interlocução junto aos órgãos de segurança pública com o intuito de promover a valoreização do Policial e dos demais agentes de segurança pública;,Segurança
Criar no calendário municipal o dia da homenagem ao agente de segurança pública que mais tiver se destacado no ano em nosso município;,Segurança
Incentivar a aproximação entre as comunidades e as políticas públicas de combate a violência e ao crime organizado.,Segurança
Implementar  a  Guarda  Municipal  para  serem  agentes  de  efetivação  dos direitos de cidadania e para protegerem o patrimônio público;,Segurança
Incentivar  o  fortalecimento  dos  laços  comunitários  e  de  vizinhança  para aumentar as redes informais de proteção social;,Segurança
"Fortalecer a Guarda Municipal e Defesa Civil os instrumentos principais da segurança  cidadã,  em  parceria  permanente  com  a  segurança  pública  do Estado do Piauí;",Segurança
"Fortalecer  as  políticas  públicas  de  prevenção  de  combate  ao  uso  de drogas  e  álcool  ,  furtos,  roubos,  focadas  no  indivíduo,  na  família,  na  escola  e na comunidade;",Segurança
Instituir  um  programa  compartilhado  entre  governo  e  sociedade  para manutenção do espaço e da ordem pública;,Segurança
"Instalação  de  câmeras  em  torres  de  observação  nas  principais  vias  de acesso, e prédios públicos que enviarão imagens de toda cidade em tempo real para uma central da Guarda Municipal",Segurança
"Criar através do projeto de lei da estrutura administrativa do município, o departamento de segurança municipal;",Segurança
Buscar parceria junto aos empresários e comerciantes locais para garantir a melhoria da segurança nos estabelecimentos comerciais;,Segurança
Construir predio do GPM e casa de apio para os policiais quando em trabalho no municipio;,Segurança
Assegurar a lotação e permanência do efetivo policial no município através de projeto de lei autorizando convênio com a SSPPI;,Segurança
Garantir iluminação pública de qualidade em toda a cidade para uma melhor atuação da polícia militar e um maior conforto e segurança dos moradores; ,Segurança
Instalação de câmeras em torres de observação nas principais vias de acesso que enviarão imagens de toda cidade em tempo real para a Policia Militar; ,Segurança
Implementar convênio com o Estado para o aumento de efetivo da Polícia Militar com o reestudo do convênio de segurança e trânsito;AGRICULTURA ,Segurança
Implantar Programa Municipal de Melhoramento Genético com o objetivo de auxiliar os produtores de leite de gado de corte e aumentar a produtividade e a renda; ,Segurança
Implantar o Programa Propriedade Sustentável com foco na sustentabilidade financeira da propriedade com acompanhamento técnico de gestão e ferramentas presenciais e on-line disponibilizadas pelo site do município; ,Segurança
Implantar programas de educação e capacitação para o fortalecimento dos agricultores transformando-os em empreendedores do agronegócio com efetivos resultados financeiros; ,Segurança
Estabelecer parceria com o Sindicato Rural e juntos planejarmos a “festa do Agricultot” com estrutura promovendo um evento de qualidade e excelência. ,Segurança
Incentivar pesquisas de viabilidade para inserção de novas lavouras para aproveitamento no período de ociosidade do solo; ,Segurança
Melhorar a assistência técnica rural com a disponibilização de servidores municipais da área para assessorar os pequenos produtores locais; ,Segurança
Cumprimento da Legislação que trata da obrigatoriedade por parte dos municípios de aquisição de gêneros da merenda escolar de produtores locais; ,Segurança
Preservar o centro de abastecimento (Mercado Municipal) garantindo higiene e qualidade nos produtos oferecidos aos consumidores bem como condições de armazenamento e comercialização para os agricultores familiares. ,Segurança
Projeto Cidade Guardiã Aprimorar e ampliar o monitoramento por câmeras de alta resolução e visualização noturna com monitores instalados no centro de inteligência local da Polícia Civil e Militar ,Segurança
Criação da Guarda Municipal Cidadã. ,Segurança
Pelotão Mirim  apoio e incentivo ao projeto social visando práticas e noções educativas  de disciplina segurança combate a violência e criminalidade. ,Segurança
Promover programas para fortalecer a segurança do município em parcerias com órgãos de segurança. ,Segurança
Elaborar o Plano Municipal de Segurança Pública ,Segurança
Implantar sistema de vide monitoramento nas entradas e saídas da cidade bem como em ruas e avenidas do município em parcerias órgãos de segurança; ,Segurança
Ampliar por meio de parceria com órgãos de segurança o efetivo de policiais no município; ,Segurança
Implantar o Pelotão Mirim em parceria com a Polícia Militar; ,Segurança
Implantar programa de palestras nas escolas com temas abordados pelos órgãos de segurança como o enfrentamento ao uso de drogas;● Programa Segurança Participativa: abrir o diálogo com a sociedade em busca de promover políticas públicas de segurança. ,Segurança
Reforço da guarda municipal com treinamentos específicos e equipamentos modernosvisando a prevenção e o combate à criminalidade.,Segurança
Criação de um centro de monitoramento integrado com câmeras de segurança em pontos estratégicos da cidade aumentando a sensação de segurança dos cidadãos. ,Segurança
Ampliar a parceria com a Secretaria de Segurança Pública do Estado do Piauí;  ,Segurança
Firmar parceria com o Governo do Estado no Combate à criminalidade e tráfico de drogas no município; ,Segurança
Atuar em parceria com o Conselho Tutelar resguardando as competências legais do órgão; ,Segurança
Aumentar o efetivo policial. ,Segurança
Criação da Guarda Municipal,Segurança
Criação dos Programas Bombeiros Mirim,Segurança
Implantação de vídeo Monitoramento,Segurança
Criar para todos os carros e motos a placa de curralinhos para identificação paralela ao Detran,Segurança
Garantir iluminação pública de qualidade em toda a cidade para uma melhor atuação da polícia militar e um maior conforto e segurança dos moradores;,Segurança
Organização e regularização do transito municipal prevendo inclusive a criação de cargos e contratação de guarda municipal para isso deverá ser enviado proposta de lei ao legislativo;,Segurança
Criação do Posto Policial no Bairro Novo Horizonte;,Segurança
Instalçao de câmeras de segurança em pontos estratégios como centro comercial vias de acesso a cidade locais de maior circulação em parcerias com policias civil e militar; ,Segurança
A segurança Pública é um tema muito relevante e também é de total interesse por parte desse governo visto que a garantia de ir e vir com segurança é um direito fundamental previsto pela Constituição Federal de 1988.,Segurança
As propostas para avançar no desempenho da Segurança com mais eficiência no município de Barra D'Alcântara no ciclo de 2025 a 2028 são:,Segurança
Iniciar o processo de implantação da Guarda Municipal para trabalhar em conjunto com o Batalhão de Polícia Militar;,Segurança
Viabilizar em parceria com o Governo Estadual a instalação de câmeras de observação nas principais vias de acesso que enviarão imagens em tempo real para a Polícia Militar;,Segurança
Realizar a municipalização do trânsito.,Segurança
Garantir iluminação pública de qualidade em toda a cidade para uma melhor atuação da polícia militar e um maior conforto e segurança dos moradores; ,Segurança
Instalar câmeras de segurança que enviarão imagens de toda cidade em tempo real para policia militar; ,Segurança
Implementar convênio com o Estado para o aumento de efetivo da Policia  Militar através de  convênio com o Estado; ,Segurança
Aquisição de motos para vigilância da Polícia Militar; ,Segurança
Segurança nas escolas; ,Segurança
Vigilância 24 horas nos bairros; ,Segurança
Implantar um programa de policiamento para atuar na violência contra as mulheres;,Segurança
Dar subsídio à Polícia Militar de acordo com a demanda; ,Segurança
Criar projetos em parcerias com a Polícia Militar Polícia Civil Ministério Público Conselho Tutelar Assistência Social Saúde Educação etc. visando o cumprimento do Estatuto da Criança e Adolescente na proibição de venda de bebidas alcoólicas armas e outros produtos para menores de 18 anos; ,Segurança
Implantação do sistema de monitoramento eletrônico no municipio de Alegrete ,Segurança
Cumprir  o Estatuto da Criança e do Adolescente coibindo a de venda de bebidas alcoólicas e outros produtos para menores de 18 anos. ,Segurança
Fortalecer as ações de segurança realizadas em parceria com as demais instituições de segurança existentes no município ,Segurança
Segurança pública nas áreas urbanas e rural; ,Segurança
Implantação de câmeras de segurança em pontos estratégicos da cidade;,Segurança
Implantação de um sistema de monitoramento eletrônico no município;,Segurança
Projeto Cidade Guardiã Aprimorar e ampliar o monitoramento por câmeras de alta resolução e visualização noturna com monitores instalados no centro de inteligência local da Polícia Civil e Militar ,Segurança
Criação da Guarda Municipal Cidadã. ,Segurança
Pelotão Mirim  apoio e incentivo ao projeto social visando práticas e noções educativas  de disciplina segurança combate a violência e criminalidade. ,Segurança
Promover programas para fortalecer a segurança do município em parcerias com órgãos de segurança.,Segurança
Criação da Guarda Municipal; ,Segurança
Implantação de vigilância comunitária nas localidades mais populosas; ,Segurança
Apoio de intensificação juntos as polícias (civil e militar) para combate a furtos e roubo. ,Segurança
Algumas ideias para área de segurança; ,Segurança
Assegurar nas escolas municipais: Palestras sobre entorpecentes; ,Segurança
Fazer cumprir a Lei que proíbe venda de bebidas alcoólicas para menores de 18 anos; ,Segurança
Proibir entrada de menores de 18 anos em Casas de Shows;  ,Segurança
Criar Políticas Públicas na Área do Esporte para crianças e adolescentes; ,Segurança
Em parceira com o governo buscar recursos para a construção de um novo prédio de uma delegacia bem como cobrar o aparelhamento da Delegacia de Polícia Civil de Prata do Piauí; ,Segurança
Fazer parceria com o Conselho Tutelar para acompanhamento familiar de alguns jovens em situação de risco; ,Segurança
Criar um canal de ligação com a população para denunciar qualquer tipo de violência sendo doméstica como de outra natureza podendo ser através de um numero que mantenha sigilo do denunciante. ,Segurança
Policiamento ostensivo com canal de ligação direta 24horas. ,Segurança
Incentivar a recolocação de pelotão mirim visando a atenção básica à criança e ao adolescente. ,Segurança
Políticas de prevenção ao crime que tenham como público alvo principalmente as crianças e os adolescentes. Algumas destas ações podem ser: ,Segurança
Programas de educação nas escolas que trabalhem na elaboração de medidas que visem a redução das ações violentas; ,Segurança
Criação de programas de profissionalização e lazer com o objetivo de ocupar os jovens no período extraclasse evitando dessa forma o seu envolvimento com atividades ilícitas; ,Segurança
Programas direcionados aos menores infratores para diminuir a chance de eles cometerem um novo crime,Segurança
Ampliação e modernização da guarda municipal. ,Segurança
Defender a criação do Consórcio Intermunicipal de Segurança Pública. ,Segurança
Implantar o Conselho Municipal de Segurança Pública. ,Segurança
