Proposta,Eixo
Instituir o Fundo Municipal de Segurança Pública. ,Segurança
Promover a transversalidade da política municipal de segurança pública junto às demais secretarias.• Providenciar a adesão do município ao Programa Nacional de Segurança Pública com Cidadania (PRONASCI) para que este esteja apto a captar recursos do governo federal.  ,Segurança
Providenciar o credenciamento do Município junto ao Sistema INFOSEG (sistema que reúne informações das justiças federal e estadual dos DETRANS etc). ,Segurança
Implantar a unidade de Defesa Civil e elaborar o Plano de Emergência do Município. ,Segurança
Instituir uma Brigada de Incêndio Municipal eficiente. ,Segurança
Implantar o Sistema de Vídeo Monitoramento por Câmeras no Município. ,Segurança
Articular através da mídia local uma campanha educativa para o trânsito. Formar (educação para o trânsito) uma turma de educadores da rede municipal de ensino de diferentes escolas. Os professores se tornarão multiplicadores do debate nas escolas trabalhando a transversalidade da temática com os estudantes utilizando as linguagens tecnológica e cênica. ,Segurança
Implantar projeto de sinalização de vias. ,Segurança
Buscar junto ao Governo do Estado o acesso à CNH Social. ,Segurança
Fazer um levantamento das vias onde seja necessário instalar redutores de velocidade (lombadas/tartarugas) para diminuir as possibilidades de acidentes. ,Segurança
Criar programa municipal que trata sobre a Violência Doméstica e de Gênero bem como sobre a Homofobia e racismo inibindo as causas socioculturais desse tipo deviolência e ao mesmo tempo proporcionando um espaço de atendimento (jurídico-psicossocial) para as vítimas como as casas de passagem. ,Segurança
Manter e ampliar as estruturas do Conselho Tutelar. ,Segurança
Fazer uma campanha de conscientização sobre a proibição da venda de bebidas alcoólicas para menores de 18 e intensificar a fiscalização nos estabelecimentos visando coibir esse ilícito. ,Segurança
Criar um Plano Integrado de Enfrentamento ao Crack e Drogas Afins que proponha: a integração articulação e ampliação das ações de saúde e assistência social; segurança pública; educação desporto cultura e direitos humanos; prevenção do uso tratamento e reinserção social de usuários de drogas contemplando a participação dos familiares e a atenção ao público vulnerável. ,Segurança
Instituir o Programa Municipal de Disseminação da Cultura de Paz na Escola. ,Segurança
Desenvolver no ambiente escolar ações de prevenção à violência e ao uso de drogas. ,Segurança
Promover palestras escolares envolvendo diretores professores pais alunos e Agentes de Segurança Pública para discutir os problemas enfrentados pela escola. ,Segurança
Realizar pesquisas para identificar situações de bullying nas escolas para que se possam direcionar as ações de forma mais intensiva naquelas com maior índice. ,Segurança
Promover Audiências Públicas para discutir e buscar soluções para a problemáticarelacionada à Segurança Pública. ,Segurança
Instituir o Olho da Comunidade – Cidadãos usando Whatsapp para denunciar atos suspeitos e/ou criminosos. ,Segurança
Viabilizar o projeto e canalizar verbas para construção de espaço adequado para o funcionamento da creche de tempo integral na sede do município.,Educação
Priorizar  investimentos  para  os  projetos  e  iniciativas  pedagógicas  das  instituições escolares.,Educação
"Regularizar  e  redefinir  a  avaliação  da  rede  pública  municipal  (Prova  SAREME2), considerando seus dados e resultados como parâmetros para a proposição de ações, formação  continuada  para  os  servidores,  docentes  e  gestores  e  articulação  de estratégias para aproximar as famílias das escolas.",Educação
"Definição da política municipal de educação para o alcance das metas no âmbito: da alfabetização das crianças até os sete (07) anos de idade, elevação dos índices de participação  e  da  média  nas  avaliações  externas  (SAEB3)  e  consequentemente melhorar o desempenho no IDEB4 e no IOEB5.",Educação
Definir  estratégias  para  eliminar  horários  ociosos  durante  o  período  de  atividades letivas.,Educação
Equipar as escolas e oferecer capacitação docente para os profissionais interagirem os processos tecnológicos a suas práticas docentes.,Educação
"Realizar  busca  ativa  nas  comunidades  para  melhorar  os  índices  de  matrículas  na rede municipal, mediante o compromisso por uma educação pública de qualidade.",Educação
"Atualizar  o  projeto  para  a  educação  especial  e  inclusiva,  instituindo  uma  política municipal centrada nas necessidades dos aprendizes.",Educação
Apoiar  a  qualificação  de  profissionais  docentes  do  quadro  efetivo  enquadrados  no atendimento de alunos neurodiversos.,Educação
"Discutir  a  aquisição  de  uma  plataforma  educacional  virtual  com  ferramentas  e ambientes de aprendizagem e interação acessíveis aos professores, alunos/famílias.",Educação
Reformar  as  Unidades  Escolares  com  estrutura  física  defasada  ou  ampliar  as Unidades  Escolares  que  atualmente  encontram-se  com  espaço  insuficiente  para atender os alunos matriculados;,Educação
Realizar concurso público para o preenchimento de vagas remanescentes no cargo efetivo de professor da rede pública de ensino;,Educação
"Promover uma educação inclusiva, com a adequação das instalações, contratação de profissionais de apoio, agenda de capacitação profissional, ensino de libras, ações de acolhimento  a  esses  alunos,  promoção  de  ações  voltadas  ao  convívio  social  na comunidade escolar e diálogo estreito com a família;",Educação
"Organizar eventos esportivos, educacionais e culturais nas escolas, como gincanas culturais, torneios esportivos interclasses e intercolegiais, semanas culturais, com apresentações artísticas, concursos educacionais de redação, português, matemática e demais matérias;",Educação
"Promover a constante avaliação da educação e dos profissionais da educação, com a valorização dos mais bem avaliados por meio de pagamento de 14º salário e apoio à especialização;",Educação
"Valorizar e premiar a excelência na educação, por meio de prêmios (como notebooks, bicicletas e outros) e apoio à família dos melhores alunos e vencedores de concursos e torneios desenvolvidos;",Educação
Promover o debate acerca da adoção do ensino em tempo integral na rede municipal de educação;,Educação
"Desenvolver  programas  de  ensino  técnico  e  profissionalizante  de  jovens,  voltado para  as  necessidades  modernas  de  emprego,  como  mídias  digitais,  áudio  e  vídeo, informática e outros.",Educação
Promoção de melhoria na estrutura física e nos equipamentos das escolas e creches;,Educação
"Garantia de transporte digno e eficiente aos estudantes que se deslocam dos povoados para a sede municipal, buscando a substituição da frota de ônibus escolares;",Educação
Realização de cursos de formação continuada para os professores;,Educação
Projetos de intensificação de melhoria da educação básica;,Educação
Implantação do Programa de Informática nas escolas;,Educação
Ampliar o número de vagas para educação infantil;,Educação
Reconstrução da Unidade Escolar Municipal “Severo Eulálio”;,Educação
Garantir a manutenção da qualidade da merenda escolar;,Educação
Ampliar a oferta de ensino em tempo integral;,Educação
Valorizar a carreira dos profissionais que integram o quadro de servidores da rede municipal de ensino;,Educação
Pagamento de 60% (sessenta porcento) dos recursos oriundos do precatório do FUNDEF aos professores da rede que fizerem jus;,Educação
"Garantir  vagas  para  todas  as  crianÁas  de  0  ao  5  ano  na  rede  municipal  de  ensino, promovendo o pleno atendimento dos educandos em creches e prÈ-escolas.",Educação
"Promover o aperfeiçoamento de todos os profissionais da rede municipal de ensino e adequar o plano de Cargos e Salários dos profissionais de educaçãoo, a fim de garantir a qualidade do ensino e melhoria da qualidade de vida da sociedade.",Educação
Ampliar e melhorar o transporte escolar para os alunos da rede municipal de ensino com o atendimento em todas as localidades da zona rural.,Educação
"Garantir a qualidade da merenda escolar, garantindo a compra de produtos  da agricultura familiar.",Educação
Garantir aos estudantes egressos do ensino mÈdio  o ingresso nos sistemas de cursos tÈcnico  e  superior  em  outros  municÌpios  com  o  suporte  atravÈs  do  transporte  escolar,Educação
"adequado, de aluguel em casas de apoio e ofertas de bolsas de estudos.",Educação
Garantir a distribuiçao de fardamento para todos os estudantes da rede municipal de ensino.,Educação
"Buscar parceria com o governo estadual e federal para ampliaçao da oferta de novos cursos  da  UAPI,  garantindo  a  oferta  do  ensino  tÈcnico  e  superior  a  todos  os  cidadoes  e  cidadoes franciscomacedense.",Educação
Implantar  escola  de  tempo  integral  para  toda  a  rede  Municipal  de  Ensino  para garantir a polÌtica nacional de educaçao.,Educação
Valorizar os profissionais da Educação;,Educação
"Implementar padrões básicos de infraestrutura física, material e de pessoal nas escolas públicas;",Educação
Fortalecer os programas de formação continuada de profissionais de educação e estabelecer bonificações por méritos e desempenho;,Educação
Implementar a escola de educação integral em tempo integral em100% das escolas e turmas;,Educação
"Ampliar e fortalecer o protagonismo juvenil, estimulando monitorias dos chamados agentes educacionais e articulando-os com os programas de pagamento de bolsas;",Educação
"Ampliar a quantidade de Centros de Interação Escola, Família e Comunidade;",Educação
Ampliar e Fortalecer  as ações Intersetoriais e parcerias com instituições públicas e privadas;,Educação
Criar o Centro de Formação para os profissionais da educação;,Educação
Implementar o Núcleo de atendimento especializado da pessoa com deficiência de Domingos Mourão;,Educação
Implementar reajustes superiores a inflação e de forma diferenciada para categoria do magistério;,Educação
Implantar esportes olímpicos nas escolas como o judô;,Educação
Entregar kit de irrigação para cada escola da rede municipal para que sejam ampliadas as ações e projetos de hortas na escola;,Educação
Perfurar poços tubulares nas escolas e implantar energia solar;,Educação
Implementar o preparatório municipal para o ENEM;,Educação
Ofertar aos estudantes universitários Casa de Apoio ao estudante nos municípios de Piripiri e Pedro II.,Educação
"Ampliar as turmas de Robótica, aulas de Informática, Educação Financeira, Empreendedorismo, através do Programa Avança Educação;",Educação
"Ampliar o acesso e valorizar o ensino profissionalizante, buscando incentivar a melhoria e expansão do ensino técnico e de serviços de assistência técnica e extensão rural;",Educação
"Promover a educação das relações étnico raciais, por meio da valorização da diversidade etnicorracional e cultural;",Educação
"Reconhecer a educação ambiental como processo continuado, permanente, formal e não formal, crítico, participativo e focado na formação de uma cidadania ativa em favor da sustentabilidade social.",Educação
"Promover políticas ativas de erradicação do analfabetismo entre as mulheres e os homens jovens, adultos e idosos.",Educação
"Implantar o Programa Alfabetiza Domingos Mourão tendo como meta a alfabetização de 100% das crianças e a redução do analfabetismo de jovens, adultos e idosos visando a elevação da escolaridade da população;",Educação
Ampliar as políticas de bonificações de alunos e respectivos professores com maior número de medalhas e certificados nas Olímpiadas externas.,Educação
Aquisição de mobiliários e equipamentos de informática;,Educação
Criar Centros Municipais de Educação Infantil – CMEIS com infraestrutura adequada ao atendimento das crianças da Educação Infanti em Tempo Integral (Creche e Pré – Escola);,Educação
Melhorar a Ampliar a Frota de Transporte Escolar garantindo conforto e segurança aos estudantes;,Educação
Melhorar a estrutura das Salas de Atendimento Educacional Especializado e ampliar a formação para Gestores e professores com foco na temática Educação Inclusiva;,Educação
Criar o Pré- Enem Municipal com preparação cognitiva e emocional com acompanhamento de Professores e Psicólogo.,Educação
Buscar junto ao Governo Estadual mais oferta de Cursos na Universidade Aberta;,Educação
Erradicar as turmas multisseriadas.,Educação
"Construir, Monitorar e Implementar o Novo Plano Municipal de Educação.",Educação
Adquirir uma caminhonete e uma moto para Secretaria de Educação;,Educação
Educacao,Educação
"Viabilizar  melhorias  nas  condições  de  funcionamento  das  escolas,  por  meio  de equipamentos, tecnologias avançadas e recursos pedagógicos;",Educação
"Fortalecer o programa de alfabetização na idade certa para reduzir a distorção idade-série, em parceria com o Estado;",Educação
Viabilizar facilidade para aquisição do auxílio financeiro para estudantes que trabalham e para aqueles em situação de vulnerabilidade;,Educação
Promover cursos de capacitação e aperfeiçoamento para os professores em educação especial;,Educação
Viabilizar e garantir uma melhor quantidade da merenda escolar;,Educação
Valorização da classe dos professores no cumprimento e no fortalecimento do Plano de Carreira dos Servidores em Educação;,Educação
"Revitalizar, Equipar, modernizar, informatizar e climatizar a Biblioteca Municipal;",Educação
Revitalizar os laboratórios de informática com internet em todas as escolas municipais para utilização dos alunos;,Educação
Promover a climatizar de todas as salas de aulas nas escolas municipais;,Educação
Promover a execução do Plano de Ação Articulada – PAR;,Educação
"Reformar, ampliar e equipar as escolas municipais;",Educação
"Viabilizar veículo para o transporte de professores, técnicos e servidores da secretaria municipal de educação;",Educação
Promover  a  Garantia  de  fardamento  para  todos  os  alunos  da  Creche  ao  Ensino fundamental da rede municipal;,Educação
"Viabilizar programa nas escolas voltado ao aprendizado para o ENEM esse programa seria em parceria com a SEDUC-PI, que ofertaria aulas online e cursos preparatórios para o ENEM, além de apoio por parte da prefeitura nos custeios dos alunos carentes que  tivessem  o  melhor  desempenho  até  o  primeiro  ano  do  ensino  médio,  de  forma aquele  aluno  ter  oportunidade  de  estudar  na  capital  durante  dois  anos,  o  segundo  e terceiro ano do ensino médio;",Educação
Implantar salas de reforços escolar para atender alunos com dificuldade na aprendizagem;,Educação
Viabilizar  formação  continuada  para  todos  os  professores  e  coordenadores  na  rede municipal de ensino;,Educação
Realizar concurso Público;,Educação
"Viabilizar  formação  e  aperfeiçoamento  para  motorista,  zeladores,  merendeiras  e serviços gerais;",Educação
Revitalizar as escolas TREZE DE MAIO,Educação
Promover Reforma da Escola ALIANÇA DO GURGUEIA em tele centros e viabilizar bibliotecas e laboratórios de informática para atender os Alunos Famílias da Comunidade;,Educação
"Repassar de forma exata ao INSS as contribuições dos servidores, a fim de evitar problemas e prejuízos no momento das aposentadorias.",Educação
"Garantir e manter a integralidade do calendário escolar, de acordo com a Lei de Diretrizes e Bases da Educação Nacional (LDB), e organizar currículos e projetos político-pedagógicos.",Educação
"Aumentar  o  investimento  na  educação  infantil  e  no  ensino  fundamental, visando à melhoria contínua da educação básica.",Educação
"Fortalecer a gestão democrática da educação, garantindo a articulação com a sociedade civil e fortalecendo o conselho municipal de educação e os conselhos  escolares,  com  base  em  critérios  estabelecidos  por  leis  e resoluções vigentes.",Educação
"Realizar levantamento e auditoria em escolas com contas irregulares, com o objetivo de restabelecer os recursos próprios das escolas.",Educação
Melhorar a estrutura das escolas rurais e urbanas.,Educação
Assegurar inclusão em todas as escolas municipais garantindo Atendimento,Educação
"Educacional Especializado (AEE), a todos que fazem parte da educação",Educação
especial.,Educação
Realizar  levantamento  (em  conjunto  com  as  famílias)  de  crianças  e adolescentes  com  dificuldades  de  aprendizagem  que  necessitam  de atendimento especializado.,Educação
Distribuir kits de material voltados para alunos do ciclo de alfabetização.,Educação
Distribuir kits de apoio pedagógico/material para professores da rede.,Educação
"Buscar convênios/parcerias para melhorar a qualidade do transporte escolar do município, planejando sua utilização de forma eficiente de acordo com as necessidades dos estudantes e dos professores .",Educação
Implantar o programa de “primeiro lanche” na educação infantil.,Educação
"Garantir o fornecimento e a qualidade da merenda escolar, incorporando produtos da agricultura local em toda a rede municipal, além de capacitar os profissionais para o manuseio e preparo alimentar nas escolas, estimulando o pequeno empreendedorismo na zona rural de Manoel Emídio.",Educação
Estimular a prática de atividades esportivas nas escolas da rede.,Educação
Melhorar os equipamentos tecnológicos das escolas.,Educação
Promover formação continuada em áreas específicas para professores e gestores escolares.,Educação
Investir em capacitação para outros profissionais da educação.,Educação
"Integrar escolas maiores em turno integral, ou expandir a carga horária dos alunos, com uma forte articulação com as áreas de esporte, ciência e cultura.",Educação
"Promover reforço escolar para alunos com dificuldades de aprendizagem, focando especialmente em leitura e escrita.",Educação
Zelar pela manutenção e fortalecimento dos programas educacionais.,Educação
"Garantir  atendimento  educacional  a  população  com  15  anos  ou  mais, reduzindo a taxa de analfabetismo funcional.",Educação
Planejar  e  implementar  um  fundo  educacional  para  poupar/recursos financeiros  destinados  à  realização  de  eventos  e  para  situações emergenciais.,Educação
"Viabilizar a criação de um núcleo multiprofissional da educação, composto por  fonoaudiólogos,  psicólogos  e  psicopedagogos,  para  ampliar  o atendimento em todas as escolas da rede municipal.",Educação
Analisar  a  viabilidade  da  construção  de  uma  nova  creche  voltada  para atender crianças de 0 a 5 anos.,Educação
Capacitar profissionais para atender públicos inclusivos nas escolas.,Educação
Garantir a segurança dos alunos no transporte escolar.,Educação
Reformulação do plano de carreira dos profissionais da educação.,Educação
"Integrar na equipe da secretaria municipal de educação uma psicopedagoga, afim de compreender os processos de aprendizagem dentro das instalações de  ensino,  indo  em  busca  de  soluções  inovadoras  para  potencializar  o aprendizado das crianças.",Educação
"Programa de construção de creches em tempo integral, para atendimento às famílias cujas mães trabalham fora de casa;",Educação
"Implantar  o  Projeto  meta  de  atendimento  a  educação,valorizando  o  plano  de cargos, carreiras e salário;",Educação
Promoção  de  melhoria  e  estrutura  física  e  nos  equipamentos  de  escolas  e creches;,Educação
"Construir  uma  escola padrão  MEC/FNDE,  para  atendimento  de  educação  em tempo integral;",Educação
Fortalecer a política do fardamento escolar com a doação municipal;,Educação
Ampliar e fortalecer a educação inclusiva nas escolas e nas famílias;,Educação
Calendário  escolar  adequado  a  realidade  da  zona  rural  e  políticas  públicas voltadas  para a valorização do professor e o aluno da zona rural;,Educação
Criar os jogos escolares para incentivar as práticas esportivas na escola.,Educação
"Fortalecer parceria com governos Estadual, Federal e outras intiutições referente a preparação para o enem.",Educação
Criar projetos de incetivos aos alunos que cursarem cursos superiores em outras cidades.,Educação
Melhorar a qualidade da merenda escolar.,Educação
Reduzir as taxas de analfabetismo no municipio.,Educação
"Promover e valorizar o Magistério respeitando os direitos adquiridos pelos profissionais da educação, através do estatuto e plano de carreira;",Educação
Criar projeto de lei para equiparação automática do piso do magistério anual nacional ao piso salarial municipal;,Educação
"Constituir equipe técnica pedagógica que atue, primordialmente, nas escolas junto aos professores e coordenadores escolares;",Educação
Dar melhor transparência na utilização dos recursos públicos;,Educação
Construir novas escolas e creches em parceria com o governo federal;,Educação
Adquirir novos ônibus para melhorar o transporte escolar e melhorar o atendimento aos estudantes da rede municipal de ensino em parceira com o governo federal;,Educação
"Garantir de forma gratuita o transporte para os universitários e estudantes de cursos técnicos não oferecidos em Jardim do Mulato, através de projeto de lei;",Educação
"Ampliar em parceria com o governo do estado, para a implantação de cursos técnicos profissionalizantes de acordo as necessidades da população;",Educação
"Implantar  e/ou  ampliar  os  laboratórios  de  informática,  laboratórios  de  ciências  da natureza e as bibliotecas das escolas municipais;",Educação
"Instalar através de parcerias, biblioteca infantil e brinquedoteca na creche;",Educação
Implantar  nas  escolas  que  ofertem  do  6º  ao  9º  anos  laboratórios  de  ciências  para  o fomento das atividades práticas;,Educação
Planejar e monitorar com eficiência o transporte escolar na zona urbana e rural;,Educação
Fornecer uma merenda escolar de qualidade com garantias nutricionais;,Educação
Ampliar as salas de Atendimento a Educação Especial – AEE;,Educação
"Ampliar gradativamente a Escola de tempo integral, atendendo ao Plano Nacional de Educação, com ênfase nos conceitos de cidadania, democracia, sustentabilidade e responsabilidade social, com o apoio do governo federal;",Educação
Viabilizar junto ao Ministério da Educação a construção de escolas necessárias para a implementação do turno integral de ensino;,Educação
Alfabetizar pelo menos 90% dos alunos na idade certa;,Educação
"Ampliar e manter a disponibilidade de acesso a internet na escola, principalmente na administração e bibliotecas;",Educação
"Capacitar os gestores, professores, equipe pedagógica, merendeiras, vigias, auxiliaries de serviços  gerais  e  equipe  administrativa  da  rede  municipal  através  de  jornadas  pedagógicas, palestras e formações continuadas;",Educação
Desenvolver atividades recreativas pedagógicas;,Educação
Implantar  núcleo  de  atendimento  psicológico  para  a  disponibilização  de  psicólogos educacionais e clínicos que atenda a comunidade escolar;,Educação
"Elaborar  projeto  pedagógico  e  plano  de  ação  anual,  através  do  efetivo  calendário acadêmico de atividades, que atendam às necessidades reais da comunidade na qual as creches e as escolas de ensinos fundamentais estão localizadas;",Educação
Fortalecer o conselho municipal a educação e criar o fórum permanente de educação para promover o debate sobre ações na área que visem os índices educacionais do município;,Educação
Estimular jovens de baixa renda aptos ao nível superior a fazerem seu curso no ensino a distância pelo sistema UAB (Universidade Aberta Brasil) no pólo da Universidade Estadual do Piauí em Jardim do Mulato;,Educação
"Criar atividades culturais, literárias e esportivas nas escolas da rede municipal de ensino com  ampla  participação  da  comunidade,  sobretudo  os  pais  e  responsáveis  por  alunos, aproximando escola e comunidade;",Educação
"Promover atividade de incentivo a leitura, como oficinas, concursos de redação, saraus, recitais, debates, encontros entre estudantes e autores, dentre outros;",Educação
"Incentivar a realização de atividades práticas nas escolas, como dias de campo, visitas a instituições culturais e científicas, projetos de pesquisas e outros;",Educação
"Potencializar o papel das escolas nas campanhas educativas sobre temáticas de segurança, da cidadania, paz social, do meio ambiente, de saúde, de trânsito, dentre outras;",Educação
Utilizar salas de aulas e horários ociosos nas escolas municipais e em instituições para ofertar oficinas culturais e cursos profissionalizantes;,Educação
Climatizar  e  modernização  da  infraestrutura  física  das  escolas  da  rede  municipal  de ensino;,Educação
Criar lei dos estagiários da educação e das demais áreas;,Educação
Dar  maior  segurança  aos  envolvidos  no  processo  ensino-aprendizagem  através  da presença da Polícia Militar nas escolas da rede.,Educação
Promover a melhoria na estrutura física e nos equipamentos das escolas e creches;,Educação
"Ampliar o número de vagas para Educação Infantil, inclusive com a construçao de creches;",Educação
Realizar busca ativa por alunos na zona rural/nas comunidades /localidades;,Educação
