Proposta, Eixo
Promover a transversalidade da política municipal de segurança pública junto às demais secretarias.• Providenciar a adesão do município ao Programa Nacional de Segurança Pública com Cidadania (PRONASCI) para que este esteja apto a captar recursos do governo federal.  
Providenciar o credenciamento do Município junto ao Sistema INFOSEG (sistema que reúne informações das justiças federal e estadual dos DETRANS etc). 
Implantar a unidade de Defesa Civil e elaborar o Plano de Emergência do Município. 
Instituir uma Brigada de Incêndio Municipal eficiente. 
Implantar o Sistema de Vídeo Monitoramento por Câmeras no Município. 
Articular através da mídia local uma campanha educativa para o trânsito. Formar (educação para o trânsito) uma turma de educadores da rede municipal de ensino de diferentes escolas. Os professores se tornarão multiplicadores do debate nas escolas trabalhando a transversalidade da temática com os estudantes utilizando as linguagens tecnológica e cênica. 
Implantar projeto de sinalização de vias. 
Buscar junto ao Governo do Estado o acesso à CNH Social. 
Fazer um levantamento das vias onde seja necessário instalar redutores de velocidade (lombadas/tartarugas) para diminuir as possibilidades de acidentes. 
Criar programa municipal que trata sobre a Violência Doméstica e de Gênero bem como sobre a Homofobia e racismo inibindo as causas socioculturais desse tipo deviolência e ao mesmo tempo proporcionando um espaço de atendimento (jurídico-psicossocial) para as vítimas como as casas de passagem. 
Manter e ampliar as estruturas do Conselho Tutelar. 
Fazer uma campanha de conscientização sobre a proibição da venda de bebidas alcoólicas para menores de 18 e intensificar a fiscalização nos estabelecimentos visando coibir esse ilícito. 
Criar um Plano Integrado de Enfrentamento ao Crack e Drogas Afins que proponha: a integração articulação e ampliação das ações de saúde e assistência social; segurança pública; educação desporto cultura e direitos humanos; prevenção do uso tratamento e reinserção social de usuários de drogas contemplando a participação dos familiares e a atenção ao público vulnerável. 
Instituir o Programa Municipal de Disseminação da Cultura de Paz na Escola. 
Desenvolver no ambiente escolar ações de prevenção à violência e ao uso de drogas. 
Promover palestras escolares envolvendo diretores professores pais alunos e Agentes de Segurança Pública para discutir os problemas enfrentados pela escola. 
Realizar pesquisas para identificar situações de bullying nas escolas para que se possam direcionar as ações de forma mais intensiva naquelas com maior índice. 
Promover Audiências Públicas para discutir e buscar soluções para a problemáticarelacionada à Segurança Pública. 
Instituir o Olho da Comunidade – Cidadãos usando Whatsapp para denunciar atos suspeitos e/ou criminosos. 